currentSection,previousSection,isMerge
"suits may be brought to collect any such damages for any month(s), and such suits shall not in any
manner prejudice Landlord's right to collect any such damages for any subsequent month(s), or
Landlord may defer any such suit until after the expiration of the Lease Term, in which event such
suit shall be deemed not to have accrued until the expiration of the Lease Term); or (b) an amount
equal to the present value (as of the date of Tenant's default) of the Base Rent and additional rent
which would have become due through the date on which the Lease Term would have expired but
for Tenant's default, which damages shall be payable to Landlord in a lump sum on demand. For
purpose of this Section, present value shall be computed by discounting at a rate equal to one (1)
whole percentage point above the discount rate then in effect at the Federal Reserve Bank nearest
to the Premises. Whether or not this Lease and/or Tenant's right of possession is terminated,
Landlord shall have the right to terminate by written notice any renewal or expansion right
contained in this Lease and to grant or withhold any consent or approval pursuant to this Lease in
its sole and absolute discretion.
16.3
Tenant hereby covenants and agrees, as a consideration for the granting by
Landlord of this Lease that, in the event of the termination of this Lease by summary proceedings,
or in the event of the entry of a judgment for the recovery of the possession of the Premises in any
action of ejectment, or if Landlord enters by process of law or otherwise, the right of redemption
provided or permitted by any statute, law or decision now or hereafter in force, and the right to
any second and further trial provided or permitted by any statute, law or decision now or hereafter
in force shall be and hereby is expressly waived by Tenant. Further, Tenant, on its own behalf and
for its legal representatives, successors and assigns, and on behalf of all persons or corporations
claiming through or under this Lease, together with creditors of all classes, and all other persons
having an interest therein, does hereby waive, surrender and give up all right or privilege which it
may or might have by reason of Sections 761 and 763 of the Real Property Actions and
Proceedings Law of the State of New York, or by reason of any other present or future law or
decision, to redeem the Premises or have a continuance of this Lease for any part of the term hereof
after having been dispossessed or ejected therefrom by process of law or otherwise.
16.4
Landlord's rights and remedies set forth in this Lease are cumulative and in addition
to Landlord's other rights and remedies at law or in equity, including those available as a result of
any anticipatory breach of this Lease. Landlord's exercise of any such right or remedy shall not
prevent the concurrent or subsequent exercise of any other right or remedy. Landlord's delay or
failure to exercise or enforce any of Landlord's rights or remedies or Tenant's obligations shall not
constitute a waiver of any such rights, remedies or obligations. Landlord shall not be deemed to
have waived any default unless such waiver expressly is set forth in an instrument signed by
Landlord. Any such waiver shall not be construed as a waiver of any covenant or condition except
as to the specific circumstances described in such waiver. Neither Tenant's payment of an amount
less than a sum due nor Tenant's endorsement or statement on any check or letter accompanying
such payment shall be deemed an accord and satisfaction. Notwithstanding any request or
designation by Tenant, Landlord may apply any payment received from Tenant to any payment
then due. Landlord may accept the same without prejudice to Landlord's right to recover the
balance of such sum or to pursue other remedies. Re-entry and acceptance of keys shall not be
considered an acceptance of a surrender of this Lease.
16.5 If Tenant fails to do any act herein required to be made or done by Tenant, then
Landlord may, but shall not be required to, make such payment or do such act. Landlord's taking
14
such action shall not be considered a cure of such failure by Tenant nor prevent Landlord from
pursuing any remedy it is otherwise entitled to in connection with such failure. If Landlord elects
to make such payment or do such act, then all expenses incurred, plus interest thereon at the Default
Rate from the date incurred to the date of payment thereof by Tenant, shall constitute additional
rent.
16.6
In the event Tenant shall default more than twice during the term hereof by failing
to pay any Base Rent or additional rent on or before the date due, then, notwithstanding that such
defaults shall have each been cured within the applicable grace period, Landlord may at any time
thereafter require that Base Rent and additional rent due hereunder be paid by certified or bank
check.
16.7
In the event any such default as set forth in paragraphs (c) and (d) of Section 19.1
above shall occur with respect to Tenant, Tenant agrees that it will either assume or reject this
Lease within sixty (60) days after the filing of the petition or the commencement of this proceeding
described in such paragraphs. In the event this Lease is not assumed within sixty (60) day period,
then Tenant deems this Lease rejected.","c) Tenant or the guarantor of Tenant's obligations hereunder (if any) shall
file a voluntary petition in bankruptcy or shall be adjudicated a bankrupt or insolvent, or
shall file any petition or answer seeking any reorganization, arrangement, composition,
readjustment, liquidation, dissolution or similar relief under the present or any future
federal bankruptcy act or any other present or future applicable federal, state or other
statute of law, or shall seek consent to or acquiesce in the appointment of any trustee,
receiver or liquidator of Tenant or of all or any substantial part of its properties or of the
Premises; or
12
d) if within sixty (60) days after the commencement of any proceeding
against Tenant or any guarantor of Tenant's obligations hereunder seeking reorganization,
arrangement, composition, readjustment, liquidation, dissolution or similar relief under
the present or any future federal bankruptcy act or any other present or future applicable
federal, state or other statute or law, such proceeding shall not have been dismissed, or if,
within sixty (60) days after the appointment, without the consent or acquiescence of
Tenant or any guarantor, of any trustee, receiver or liquidator of Tenant of any guarantor
or of all or any substantial part of its properties or of the Premises, such appointment shall
not have been vacated or stayed on appeal or otherwise, or if, within sixty (60) days after
the expiration of any such stay, such appointment shall not have vacated.
16.2
If there shall be an Event of Default at any time, then the provisions of this Section
shall apply. Landlord shall have the right, at its sole option, to terminate this Lease. In addition,
with or without terminating this Lease, Landlord may re-enter, terminate Tenant's right of
possession and take possession of the Premises. The provisions of this Section shall operate as a
notice to quit, any other notice to quit or of Landlord's intention to re-enter the Premises being
expressly waived. If necessary, Landlord may proceed to recover possession of the Premises under
applicable laws, by such other proceedings, including re-entry and possession, or by using such
force as may be necessary. If Landlord elects to terminate this Lease and/or elects to terminate
Tenant's right of possession, then everything in this Lease to be done by Landlord shall cease,
without prejudice, however, to Tenant's liability for all rent and other sums due hereunder.
Landlord may relet the Premises or any part thereof, alone or together with other premises, for
such term(s) (which may extend beyond the date on which the Lease Term would have expired
but for Tenant's default) and on such terms and conditions (which may include concessions or free
rent and alterations of the Premises) as Landlord, in its sole discretion, may determine, but
Landlord shall not be liable for, nor shall Tenant's obligations be diminished by reason of,
Landlord's failure to relet the Premises or collect any rent due upon such reletting. If Landlord
relets the Premises and collects rent in excess of the Base Rent and additional rent owed by Tenant
hereunder, Landlord shall be entitled to retain any such excess and Tenant shall not be entitled to
a credit therefor. Whether or not this Lease is terminated, Tenant nevertheless shall remain liable
for the Base Rent, additional rent and damages which may be due or sustained, and all costs, fees
and expenses (including without limitation attorneys' fees, brokerage fees and expenses incurred
in placing the Premises in first-class rentable condition) incurred by Landlord in pursuit of its
remedies and in renting the Premises to others from time to time. Tenant shall be liable for all rent
that would have applied to any period of occupancy of the Premises (whether or not any such
period has elapsed) for which Tenant was hereunder granted occupancy without any obligation to
pay such rent (if any). Tenant shall also be liable for additional damages which at Landlord's
election shall be either: (a) an amount equal to the Base Rent and additional rent which would
have become due during the remainder of the Lease Term, less the amount of rental, if any, which
Landlord receives during such period from others to whom the Premises may be rented (other than
any additional rent payable as a result of any failure of such other person to perform any of its
obligations), in which case such damages shall be computed and payable in monthly installments,
in advance, on the first day of each calendar month following Tenant's default and continuing until
the date on which the Lease Term would have expired but for Tenant's default (provided, however,
that if at the time of any reletting of the Premises there exists other space in the Facility available
for Leasing, then the Premises shall be deemed the last space rented, even though the Premises
may be relet prior to the date such other space is leased and provided further, however, that separate
13",1
"Act, as amended from time to time, (d) ""hazardous materials,"" as defined by the Hazardous
Materials Transportation Act, as amended from time to time, (e) any substance, material or other
item designated as hazardous or toxic under any applicable state or local laws or the regulations
adopted thereunder, as same may be amended from time to time, (f) oil or other petroleum
products, (g) any highly combustible substance, (h) any biologically or chemically active
substance and (i) any substance whose presence in Landlord's reasonable judgment could be
detrimental to the Premises or the Facility or hazardous to health or the environment. In addition,
Tenant shall execute affidavits, representations and the like from time to time at Landlord's request
concerning Tenant's best knowledge and belief regarding the presence of Hazardous Materials in
the Premises. In all events, Tenant shall indemnify Landlord in the manner elsewhere provided in
this Lease from any release of Hazardous Materials in or about the Premises or the Facility
occurring while Tenant is in possession, or elsewhere if caused by Tenant or persons acting under
Tenant. The within covenants shall survive the expiration or earlier termination of the Lease Term.","SECTION 18
ENVIRONMENTAL
Tenant shall not (either with or without negligence) generate, use, store, or cause or permit
the escape, disposal or release of any Hazardous Materials in or about the Premises or the Land.
Hazardous Materials shall mean (a) ""hazardous wastes,"" as defined by the Resource Conservation
and Recovery Act of 1976, as amended from time to time, (b) ""hazardous substances,"" as defined
by the Comprehensive Environmental Response, Compensation and Liability Act of 1980, as
amended from time to time, (c) ""toxic substances,"" as defined by the Toxic Substances Control
15",1
"between Lessor and Company by such condemning authority, or (ii) deposited promptly
with Leasehold Mortgagee (or in the event that there is no lender of record, with an
escrow agent selected by Company in the reasonable exercise of its discretion), if only a
single award is made, and distributed and disbursed as set forth above. Sums being held
by the escrow agent pending disbursement shall be deposited in a federally insured
interest bearing account and, upon disbursement, each party having a right to any of the
sums being disbursed shall be entitled to receive the interest attributable to its share of
said sums.
2.19.6 In the event of a Temporary Taking, this Agreement shall remain in full force and effect,
neither the rents reserved hereunder nor the term hereof shall be reduced or affected in
any way, and, subject to Section 1.1.25, Company shall be entitled to any award for the
use or estate taken, subject to the requirements of any Leasehold Mortgagee.
2.19.7 Unless the respective values are determined by the court in the eminent domain
proceeding, the values of the interests for which Lessor and Company are entitled to
compensation in the event of a Total or Partial Taking shall be determined by the mutual
written agreement of Lessor and Company. If Lessor and Company are unable to agree
on the value of said interests within thirty (30) days after the deposit of the sums awarded
with the escrow agent, then within thirty (30) days after the expiration of that period,
each such party shall submit its good faith estimate of the value of said interests as of the
date of the taking. If the higher of said estimates is not more than 105% of the lower of
such estimates, the value shall be the average of the submitted estimates. If otherwise,
then within ten (10) days the question shall be submitted to arbitration pursuant to the
rules of the American Arbitration Association.","d.
Fourth, subject to Section 1.1.25, the balance of the Award to Company.
All sums awarded for the leasehold or the fee shall (i) be delivered to Lessor and
Company (or to Leasehold Mortgagee), respectively, if such award has been apportioned
IBC Bldg. 1 Ground Lease
24
1112021",1
"SECTION 20
EMINENT DOMAIN
If the whole or part of the Premises shall be taken or condemned by a competent authority
for any public or quasi-public use or purpose, then, in that event, the term of this Lease, at the
option of the Landlord, shall cease and terminate. Tenant shall not make any claim against
Landlord or the authority for any portion of such award, damages or compensation attributable to
damage to the Premises, value of the unexpired portion of the Lease Term, loss of profits or
goodwill, leasehold improvements or severance damages. Nothing contained herein, however,
shall prevent Tenant from pursuing a separate claim against the authority for relocation expenses,
provided that such claim is stated separately from any award to Landlord and provided further that
16
such claim shall in no way diminish the award, damages or compensation otherwise payable to
Landlord in connection with such condemnation.","SECTION 19
PREMISES UNTENANTABLE
If the Premises be damaged by fire or other causes, Tenant shall immediately notify
Landlord thereof, and the damages shall be repaired by Landlord, at its own expense; provided,
however, that if the damage or destruction was caused by the act or omission of Tenant or any
Invitee, then Tenant shall pay the amount by which such expenses exceed the insurance proceeds
actually received by Landlord on account of such damage or destruction. Landlord need only
repair the damaged structural parts of the Premises and is not required to repair or replace any
equipment, fixtures, furnishings or decorations unless originally installed by Landlord. Landlord
is also not responsible for delays due to settling insurance claims, obtaining estimates, labor and
supply problems or any other cause not fully under Landlord's control. In the event of any casualty,
the Lease shall not terminate and the rent shall not abate, but shall remain in full force and effect.
If, however, more than fifty percent (50%) of the Premises are rendered untenantable by fire or
other cause, at any time, or a casualty occurs and Landlord determines that the repair and
restoration of the Premises will take more than ninety (90) days, then Landlord shall have and is
hereby given the option to terminate Lease upon notifying Tenant in writing of Landlord's intention
to so terminate within 60 days of the date of destruction, and, in that event, this Lease shall be
deemed to be terminated as of the date of Landlord's notice, and rent payments shall be apportioned
as of that date. Tenant hereby expressly waives the provisions of Section 227 of the Real Property
Law and agrees that the foregoing provisions shall govern in lieu thereof.",0
"Premises that they shall be installed at Tenant's expense. Landlord shall have access during the
last six months of the term of this Lease for the purpose of exhibiting the Premises and putting up
the usual notice ""To Rent"" which notice shall not be removed, obliterated or hidden by Tenant.
The rights of access granted to Landlord hereunder shall, except in the event of an emergency, be
exercised so as not to unreasonably interfere with the conduct of Tenant's business.","SECTION 23
ACCESS TO PREMISES
Landlord shall have the right to install and maintain in the Premises all water, drain, gas,
heating pipes and fixtures and electrical wiring and all other appliances necessary for the operation
of the balance of the building of which the Premises are a part and shall have access to the Premises
at all reasonable times and in case of emergency at any time for the purpose of examining the same
or making such repairs or changes thereto or to the pipes, wires, fixtures and appliances referred
to above as Landlord may deem necessary. Tenant agrees that it will not install any equipment
which will exceed the capacity of the utility lines leading into the Premises or the building and that
if any equipment so installed shall require additional utility facilities to be brought into the
17",1
"1.1
DEFINITIONS
In addition to the terms defined elsewhere in this Agreement, the following terms shall have the
following meanings:
1.1.1
The term ""Approved Budget,"" whenever used herein, means any written budget prepared
by Company and approved by the Lessor's Designated Representative pursuant to the
procedure set forth in Section 1.6 entitled BUDGET APPROVAL.
1.1.2
The term ""Assignee,"" whenever used herein, means the purchaser or any heir, successor,
or assign of a lender subsequent to a sale or assignment as defined in Section 2.18
entitled FINANCING.
1.1.3
The term ""Capital Improvement Expenditures,"" whenever used herein, means any
expenses associated with the Facilities (other than the costs and expenses of their initial
construction) which are treated as capital expenditures under generally accepted
accounting principles, consistently applied.
IBC Bldg. 1 Ground Lease
1
1112021
1.1.4 The term ""Lessor's Designated Representative (hereinafter referred to as 'LDR'),""
whenever used herein, means the Executive Director of Lessor, or a successor designee
acting on behalf of the Lessor.
1.1.5 The term ""Commence Construction,"" whenever used herein, means commencing
construction of the Facilities on the Premises by Company causing its construction
contractor to obtain occupancy and control of the area and to begin actual site
development and construction thereon.
1.1.6
The term ""Facilities,"" whenever used herein, means all the buildings, utilities, rail
improvements, site development work, parking lots, roadways, landscaping and other
improvements constructed by Company on the Premises in accordance with the terms and
conditions of this Agreement.
1.1.7
The term ""Company,"" whenever used herein, means Industry East Business Center, LLC,
a limited liability company authorized to do business in the State of California, which is
entering into this Agreement as the developer and operator of the Facilities on the
Premises as described herein.
1.1.8
The term ""Lessor,"" whenever used herein, means the Successor Agency to the Industry
Urban-Development Agency, a body corporate and politic, and where this Agreement
speaks of ""Approval by Lessor,"" or ""Approved by Lessor,"" such phrases mean
approving action by the Successor Agency to the Industry Urban-Development Agency.
1.1.9 The term ""CC&Rs,"" whenever used herein, means any Covenants, Conditions and
Restrictions developed by the Company and approved by the LDR for Sublessees and
Tenants which will include, but not be limited to, specific guidelines for uses of the
Premises.
1.1.10 The term ""Debt Service,"" whenever used herein, means the Company's payment of
principal, interest and any other sum due and owing (monthly or otherwise) pursuant to
the terms and conditions of any Leasehold Mortgage for construction, interim and/or
permanent financing of the Facilities, but excluding any penalties, late charges, default
interest and other amounts (except principal and interest) payable solely as a result of a
breach or default under such Leasehold Mortgage, unless such breach or default is caused
in part by the acts or omissions of Lessor, including the failure of Lessor to make Capital
Contributions as called for in this Agreement .
1.1.11 The term, ""Commencement Date,"" whenever used herein, means the date that the term of
this Lease commences under the terms of Section 1.2.1 below.
1.1.12 The term ""Environmental Laws,"" whenever used herein, means any one or all of the laws
and/or regulations of the Environmental Protection Agency or any other federal, state or
local agencies regulating Hazardous Material, including, but not limited to the following
as the same are amended from time to time:
COMPREHENSIVE ENVIRONMENTAL RESPONSE, COMPENSATION
AND LIABILITY ACT (42 U.S.C. Section 9601 et seq.)
RESOURCE CONSERVATION AND RECOVERY ACT (42 U.S.C. Section
6901 et seq.)
TOXIC SUBSTANCES CONTROL ACT, as amended (15 U.S.C. Section 2601
et seq.)
SAFE DRINKING WATER ACT (42 U.S.C. Section 300h et seq.)","ARTICLE I",1
