currentSection,previousSection,isMerge
", and that
no others shall use or occupy or be permitted to use the demised Premises. The Premises shall only be used for
residential use.","1.
Use: The Premises must be used only as private Premises to live in as the primary residence of the Tenant
and for no other reason. The Premises shall not be used to carry on any type of business or trade. Tenant
covenants that the only persons who will reside within the demised Premises are Tenant and those individuals
named herewith",1
"Section 1 above, and based upon the advice and assistance of the South Carolina
Department of Revenue and the Board of Economic Advisors, as required, County
Council hereby find that:
(a)
Phase I constitutes a ""project"" as that term is defined in the FILOT Act;
(b)
Phase I will serve the purposes of the FILOT Act;
(c)
the investment by the Company in Phase I will be approximately $35
,000,000 to be invested within five (5) years from the end of the property tax year in
which the investor and the County execute the Fee Agreement;
(d)
Phase I will be located entirely within Charleston County;
(e)
Phase I is anticipated to benefit the general public welfare of Charleston
County by providing services, employment, recreation, or other public benefits not
otherwise adequately provided locally;
(f)
Phase I gives rise to no pecuniary liability of the County or no charge
against its general credit or taxing power;
(g)
the purposes to be accomplished by Phase I are proper governmental and
public purposes;
(h)
the inducement of the location of the Project is of paramount importance;
and
(i)
the benefits of Phase I to the public are greater than the cost to the public.","Section 2. Findings by County Council. Based upon their investigation of the
Project and information provided by the Company, including the criteria described in",1
"The Company does hereby lease to the Agency, and the Agency hereby leases from the
Company, the Land described in Exhibit A, including all improvements thereto (but excluding the Lessee's
Property and any Existing Facility Property released pursuant to Section 3.6 of the Lease Agreement), for
the term herein provided and for use as provided in the Lease Agreement. It is the intention of the Company
and the Agency that a leasehold estate in all improvements to the Facility Realty hereafter made by the
Company shall vest in the Agency as and when the same are effected. Accordingly, the Company and the
Agency agree that the Agency shall hold a leasehold estate in all improvements hereafter made by the
Company to the Facility Realty (but excluding the Lessee's Property and any Existing Facility Property
released pursuant to Section 3.6 of the Lease Agreement).","ARTICLE III",1
"The term of this Company Lease shall commence on March [30], 2023 (the
""Commencement Date"") and expire on the earliest of (i) 11:59 p.m. (New York City time) on June 30,","ARTICLE IV",1
"2049, (ii) such earlier date as may be provided in accordance with the terms of the Lease Agreement or (iii)
the termination of the Lease Agreement as provided therein.","The term of this Company Lease shall commence on March [30], 2023 (the
""Commencement Date"") and expire on the earliest of (i) 11:59 p.m. (New York City time) on June 30,",1
"The Company hereby delivers possession to the Agency of the Facility Realty.","ARTICLE VI",1
"The Company covenants and agrees that, so long as the Lease Agreement shall be in full
force and effect, the Agency shall have, hold and enjoy a valid leasehold estate in the Facility Realty during
the term hereof (subject to Permitted Encumbrances), and the Company shall from time to time take all
necessary action to that end.","ARTICLE VII",1
"Except for the Lease Agreement, this Company Lease contains the entire agreement
between the parties hereto with respect to the subject matter hereof, and all prior negotiations and
agreements are merged in this Company Lease. This Company Lease shall only be changed, modified or
discharged in whole or in part by a written instrument executed by the Company and the Agency. No
consent or approval of the Company shall be deemed to have been given or to be effective for any purposes
unless such consent or approval is set forth in a written instrument executed by the Company. No consent
or approval of the Agency shall be deemed to have been given or to be effective for any purposes unless
such consent or approval is set forth in a written instrument executed by the Agency.","ARTICLE VIII",1
"All notices, certificates or other communications hereunder shall be sufficient if sent (i) by
registered or certified United States mail, return receipt requested and postage prepaid, (ii) by a nationally
recognized overnight delivery service for overnight delivery, charges prepaid or (iii) by hand delivery,
addressed, as provided in Section 11.5 of the Lease Agreement.","ARTICLE IX",1
"This Company Lease shall be governed by, and construed and enforced in accordance with,
the laws of the State, without regard or giving effect to the principles of conflicts of laws thereof.
The terms of this Company Lease are and shall be binding upon and inure to the benefit of
the Agency and the Company and their respective successors and assigns.
If any one or more of the provisions of this Company Lease shall be ruled illegal or invalid
by any court of competent jurisdiction, the illegality or invalidity of such provision(s) shall not affect any
of the remaining provisions hereof, but this Company Lease shall be construed and enforced as if such
illegal or invalid provision had not been contained herein.
This Company Lease shall completely and fully supersede all other prior understandings
or agreements, both written and oral, between the Agency and the Company relating to the Facility, other
than the Lease Agreement or any other Project Document.","ARTICLE X",1
"This Company Lease shall become effective upon its delivery on the Commencement Date.
It may be simultaneously executed in several counterparts, each of which shall be an original and all of
which shall constitute but one and the same instrument.
US_154764332v4
- 6 -","ARTICLE XI",1
"This Company Lease is and shall be subject and subordinate in all respects to any Mortgage
and to such mortgage liens and security interests so created thereby; provided, however, that nothing in any
Mortgage shall impair the Agency's ability to enforce its rights hereunder against the Company.","ARTICLE XIII",1
"The Agency and the Company agree that this Company Lease shall be recorded, or caused
to be recorded, by the Agency (at the sole cost and expense of the Company) in the appropriate Office of
the Register of The City of New York.
US_154764332v4
- 7 -","ARTICLE XIV",1
"2.
Term. The term of this Lease shall be for 10 years, commencing on Apr 4, 2019 (the
""Commencement Date"") and ending on Mar 31, 2029.
(Delete the following paragraph if Tenant is not to receive early occupancy.)
Tenant may have possession of the Premises prior to the above stated Commencement Date
only upon completion of Landlord's work, if any, and after Tenant has provided the insurance
documentation called for in this Lease, delivered the security deposit, and placed utilities in
Tenant's name. If Tenant takes such early possession, all terms and conditions of this Lease
shall be instantly in full force and effect upon occupancy except payment of Base Rent as
2
herein described which shall be free during the interim period prior to the Commencement
Date.","1.
Premises.
1.1.
The Landlord hereby leases to the Tenant the area (the ""Premises"") identified on
Schedule A attached hereto and known as 2 within the building identified as The
Kunde - Grimes (the ""Building"") which is part of the larger property known as
Goodwin - Koelpin Industrial, 25 Hill Road, City of Parma, State of New York (""the
""Property""). For purposes of this Lease, the rentable area of the Premises shall be
deemed to be 2500 square feet.
1.2.
The Tenant shall have the right to use in common with the other tenants any common
elements consisting of the bathroom(s), interior corridors, driveways, parking lots,
lawns and other areas common to all tenants (the ""Common Elements"" or ""Common
Areas""). Tenants, its agents, employees and contractors are not allowed access to any
roof area, at any time, without prior written approval of the Landlord. Violations will
require the Tenant to be responsible for all future roof leaks.
1.3.
This Lease does not include any exterior storage and Tenant covenants and agrees that
it will not store or place outside of the Premises, any items of any kind, including, but
not limited to, trash, oil barrels, etc., and that it will dump no oil, other liquids or solids
on the ground or surrounding premises. It is understood and agreed that Tenant is
leasing only the interior of the Premises.
1.4.
Notwithstanding the above, Tenant shall be responsible for removal of its business
waste and may maintain a dumpster in an area specified by Landlord.",0
"3.
Rent.
3.1.
The Tenant shall pay to the Landlord during the term of this Lease, without offset or
deduction and without any prior demand, the following Base Rent (the ""Base Rent""
or ""Annual Rent"") in equal monthly installments in advance on the first day of each
month:
Lease Year
Annual Rent
Monthly Rent","2.
Term. The term of this Lease shall be for 10 years, commencing on Apr 4, 2019 (the
""Commencement Date"") and ending on Mar 31, 2029.
(Delete the following paragraph if Tenant is not to receive early occupancy.)
Tenant may have possession of the Premises prior to the above stated Commencement Date
only upon completion of Landlord's work, if any, and after Tenant has provided the insurance
documentation called for in this Lease, delivered the security deposit, and placed utilities in
Tenant's name. If Tenant takes such early possession, all terms and conditions of this Lease
shall be instantly in full force and effect upon occupancy except payment of Base Rent as
2
herein described which shall be free during the interim period prior to the Commencement
Date.",0
"10.
Waiver of Subrogation Rights. The Landlord, Property Manager and the Tenant and all
parties claiming under them hereby mutually release and discharge each other from all claims
and liabilities arising from or covered by insurance on the Premises or covered by insurance
in connection with property on or activities conducted on the Premises regardless of the cause
of the damage or loss. Each party shall secure from its insurer proof that its respective insurer
honors this provision.","9.
Insurance and Casualty Loss.
9.1. During the term of this Lease the Tenant, at its sole expense and for the mutual benefit
of the Landlord, Buckingham Properties LLC (the ""Property Manager""), and the
Tenant, all of which shall be named insureds on all applicable policies, shall carry
6
and maintain comprehensive public liability insurance, including property damage,
insuring the Landlord, Property Manager, and the Tenant against liability for injury to
persons or property occurring in or about the Premises and the Common Elements or
arising out of ownership, maintenance, use, or occupancy of the Premises and the
Common Elements, in at least the amounts of $2,000,000.00 combined single limit
for bodily injury or property damage. At the execution of this Lease, the Tenant shall
deliver to the Landlord certificates of insurance indicating that this coverage is in ef-
fect as per Certificate of Insurance form attached hereto as Schedule B. Tenant's
policy shall contain a clause providing that the insurer will not cancel the insurance
without giving Landlord thirty (30) days prior written notice.
9.2.
The Landlord shall during the term of this Lease maintain and pay for fire and extend-
ed coverage insurance against risk of all physical loss to the Property, insurance
against loss of rental income from the Property, and comprehensive public liability
insurance, in amount to be reasonably determined by Landlord. Tenant shall pay as
Additional Rent its Pro Rata Share of the Insurance attributable to the Building and/or
Property in which the Premises is located for fire and extended coverage, liability and
loss of rents during the Lease Term.
9.3.
The Tenant shall maintain appropriate levels of insurance upon its leasehold improve-
ments, inventory and equipment and shall provide Landlord with certificates
evidencing such insurance. Neither Landlord nor Property Manager shall have any
liability to Tenant for the damage or destruction of Tenant's leasehold improvements,
inventory, equipment or other personal property.
9.4.
Tenant shall not use the Premises or permit their use for any activity which shall cause
any increase in the premiums for fire and extended coverage insurance upon the
Premises. If Tenant, nonetheless does so, Tenant shall reimburse the Landlord for any
such increase of premiums resulting from the Tenant's use of the Premises.",0
"26.
Integration of Agreement. This Lease is intended and shall be deemed to be the complete
statement of the terms of the agreement between the parties and shall be deemed to have inte-
14
grated all promises, conditions, understandings, representations, and warranties, if any, be-
tween the Landlord and the Tenant.","25.
Binding Effect. This Lease shall be binding upon and enure to the benefit of the Landlord
and the Tenant and their respective heirs, personal representatives, successors, and assigns. If
any term or provision of this Lease shall be determined to be to any extent invalid or uncon-
scionable, then to that extent such term or provision shall be deemed void and unenforceable,
but the remaining terms and provisions of this Lease shall be valid and enforceable.",0
"SECTION 3
RENT
3.1 Tenant shall pay to Landlord, during the term of this Lease, and any renewal thereof,
in lawful money of the United States, without any prior demand and without any setoff or
deduction whatsoever, base rent (""Base Rent"") as follows:
a)
Commencing on the Commencement Date, or on such earlier date that
Tenant enters into possession of the Premises for the purpose of conducting its business therein,
Tenant shall pay Base Rent to Landlord the amount of $37,800.00 per year, payable in advance, in
equal monthly installments of $3150. [Commencing on the first day of the second Lease Year
and on the first day of each Lease Year thereafter, the Base Rent shall be increased to an
amount equal to one hundred and three percent (103%) of the Base Rent payable in the
preceding Lease Year and the Base Rent shall continue to be payable in monthly
installments.]
[Delete Section 3.1(b) if the deal does not include renewal options.]
b)
If Tenant exercises its option to renew the term of this Lease, then the annual
Base Rent shall continue to increase as of the first day of each Lease Year of the Renewal Term in
an amount equal to one hundred one hundred and three percent (103%) of the annual Base Rent
payable in the preceding Lease Year and the annual Base Rent shall continue to be payable in
monthly installments in advance.
3.2
On the first day of each and every month during the term of this Lease, Tenant
covenants and agrees to pay to Landlord an amount equal to the sum of the monthly installments
of rent set forth herein plus the monthly installments of additional rent set forth in this Lease.
3.3
Tenant covenants and agrees to pay the rent set forth herein to the Landlord at its
offices described above or at such other place as the Landlord may from time to time designate by
written notice to Tenant. Landlord's acceptance of rent after it shall have become due and payable
shall not excuse a delay upon subsequent occasions nor constitute a waiver of rights,
notwithstanding any endorsement or restriction that Tenant may include with such payment. If
Tenant shall have been late in the payment of any installment of rent or if any payment of rent by
check has been returned for insufficient funds or if tenant otherwise defaults under this Lease,
Landlord may at any time thereafter require that all payments of rent and additional rent due
hereunder be paid by certified check.
3.4
Tenant agrees to pay a ""late charge"" equal to five (5%) per cent of the payment due,
for any payment of rent or additional rent not received by Landlord by the fifth (5th) day of the
4
month due. Such payment and such late fee shall bear interest at the rate of eighteen percent (18%)
per annum (the ""Default Rate"") from the date such payment was due to the date of payment.","SECTION 2
TERM
2.1
The term of this Lease (the ""Lease Term"") shall be ten (10) years [commencing on
July 9, 2018 and, unless sooner terminated, ending on June 30, 2028], and shall commence on
the date that Landlord substantially completes the initial improvements to the Premises to be
provided by Landlord pursuant to Exhibit ""B"" (the ""Commencement Date""); provided, however,
that if the Commencement Date is not the first day of a calendar month, then the Lease Term shall
be ten (10) years plus the partial month in which the Commencement Date occurs. The Lease Term
shall also include any properly exercised renewal or extension of the term of this Lease. Lease
Year shall mean a period of twelve (12) consecutive months commencing on the Lease
Commencement Date (plus the partial month in which the Lease Commencement Date occurs if
the Lease Commencement Date is not the first day of a month) and each successive twelve (12)
month period thereafter.
2
2.2
The Work shall be deemed to be substantially complete when the work and
materials to be provided by Landlord pursuant to Exhibit B attached hereto (except for items of
work and adjustment of equipment and fixtures that can be completed after the Premises are
occupied without causing substantial interference with Tenant's use of the Premises (i.e., the
""punch list"" items)) have been completed, as determined by Landlord. Notwithstanding the
preceding sentence, if Landlord shall be delayed in completing the work and materials to be
provided pursuant to Exhibit B as a direct or indirect result of (1) Tenant's failure to comply with
any of its duties and obligations hereunder or with any deadlines specified in Exhibit B, (2)
Tenant's request for modifications to plans or working drawings subsequent to the date such plans
or working drawings are approved by Tenant, (3) Tenant's failure to pay when due any amount
required pursuant to Exhibit B, (4) Tenant's request for materials, finishes or installations not
deemed by Landlord to be building standard materials, finishes or installations, (5) any change
orders requested by Tenant, or (6) the performance of any work by any person or firm employed
or retained by Tenant, then for purposes of determining the Lease Commencement Date, the work
and materials to be provided pursuant to Exhibit B shall be deemed to have been substantially
complete on the date that Landlord determines that such work and materials would have been
substantially complete if such delay(s) had not occurred.
2.3
It is presently anticipated that the Premises will be delivered to Tenant within
approximately three (3) from the date of execution of this Lease. If Landlord does not complete
construction and deliver possession of the Premises by such date, then Landlord shall not have any
liability whatsoever, and this Lease shall not be rendered voidable on account thereof.
[Delete Section 2.4 if the deal does not include renewal options.]
2.4
Landlord hereby grants to Tenant the conditional right, exercisable at Tenant's option,
to renew the term of this Lease for () term(s) of ten (10) years. If exercised, and if the conditions
applicable thereto have been satisfied, the Renewal Term ([each, a] the ""Renewal Term"") shall
commence immediately following the end of the then-current Lease Term. The right of renewal
herein granted to Tenant shall be subject to, and shall be exercised in accordance with, the following
terms and conditions:
(a)
Tenant shall exercise its right of renewal with respect to the applicable Renewal Term
by giving Landlord written notice thereof not later than six (6) months prior to the expiration of the
then-current Lease Term ([each, a]the ""Renewal Notice""). During the Renewal Term, all terms and
conditions of this Lease shall remain the same, except that the annual Base Rent payable for the first
Lease Year of the Renewal Term and each Lease Year thereafter shall be as set forth in Section 3.1
below. If Tenant timely and validly exercises its right of renewal, then, at Landlord's option, Landlord
and Tenant shall promptly enter into an amendment to this Lease reflecting the terms described above.
(b)
If the Renewal Notice is not given timely, then Tenant's right of renewal pursuant
to this Section shall lapse and be of no further force of effect.
(c)
If Tenant is in default under this Lease on the date that the Renewal Notice is given
to Landlord or at any time prior to the commencement of the Renewal Term, then, at Landlord's
option, the Renewal Term shall not commence and the term of the Lease shall expire at the
expiration date of the term of this Lease.
3
(d)
If at any time this Lease has been assigned or any portion of the Premises has been
subleased, then Tenant's rights pursuant to this Section shall lapse and be of no further force or
effect.
(e)
Tenant's right of renewal under this Section may be exercised by Tenant only and
may not be exercised by any transferee, sublessee or assignee of Tenant.",0
