currentSection,previousSection,isMerge
"2.1
ASSIGNMENT
2.1.1 Company will not assign this Agreement or its rights or duties hereunder or any estate
created hereunder, in whole or in part, except with the prior written approval of Lessor,
which approval will not be withheld unreasonably or delayed; provided, that it shall be
reasonable for Lessor to withhold its approval if the assignee presented is not a proper
and fit person or entity with financial resources and demonstrated business experience
sufficient in Lessor's reasonable business judgment to be capable of performing the
obligations hereunder which are the subject of the assignment. Further, any such
assignment will be specifically subject to all provisions of this Agreement. Any
assignment without the prior written approval of Lessor is Void.
2.1.1.1
Except as provided in Section 2.1.1.3, any voluntary or involuntary
transfer of fifty percent (50%) or more of Company's or any permitted
successor's or assign's voting common stock, or the transfer of fifty
percent (50%) or more of the partnership or membership interest, or the
acquisition or transfer of fifty percent (50%) or more of Company's
ownership, or the transfer of substantially all of the assets of the
Company or any such successor or assign will be deemed an assignment
requiring the prior written approval of Lessor.
2.1.1.2
As a condition precedent to any assignment, Company shall provide
Lessor reasonable prior written notice of the proposed assignment with
such appropriate documentation and other information as Lessor shall
reasonably request in order for Lessor to make its decision to grant or
withhold approval. If the prior written approval of Lessor is given to any
such assignment, the proposed assignee shall, in recordable form,
expressly assume all of the terms, covenants and conditions of this
Agreement which are the subject of the assignment. Any assignment
will not release Company from its obligations under this Agreement
arising from events occurring prior to the date of assignment, but shall
release Company from all obligations arising after the effective date of
the assignment.
IBC Bldg. 1 Ground Lease
11
1112021
2.1.1.3
Any transfers by partners or members of Company or shareholders of
partners or members of Company to each other or for estate purposes or
upon death will not be considered an assignment hereunder.
2.1.2
The foregoing provisions relating to assignment shall not be applicable to a Leasehold
Mortgage hypothecating or encumbering Company's interest in this Agreement and the
leasehold estate created thereby and the Facilities located on the Premises and further
shall not be applicable to any sale by judicial foreclosure or pursuant to a power of sale
by any Leasehold Mortgagee or to any transfer in lieu of such sale, or to any sales or
transfers by any Leasehold Mortgagee (or any affiliate, parent or subsidiary of any
Leasehold Mortgagee that acquires title to the Company's interest in this Agreement and
the leasehold estate created thereby and the Facilities as a result of a sale by judicial
foreclosure or pursuant to a power of sale or any transfer in lieu of such sale), subsequent
to a sale by judicial foreclosure or pursuant to a power of sale or subsequent to any
transfer in lieu of such sale. Any further assignments shall be subject to the provisions of
Section 2.1, 2.1.1.1, 2.1.1.2 and 2.1.1.3.","ARTICLE II",1
"Throughout the term of this Agreement, Company shall pay before delinquency, as a Project
Cost, all real and personal property taxes and assessments, including, without limitation, all city,
county, school district and other taxes and general and special assessments, levied upon or
assessed against the Premises, any Facilities now or hereafter located thereon, the leasehold
estate, any personal property of Company located on or in the Premises or any Facilities, or
arising in respect of the occupancy, use or possession of the Premises or the Facilities located
thereon and which are assessed or become due during the term of this Agreement. All such taxes
for the first and last years of the term hereof shall be equitably prorated between the parties.
Company shall have the right, in Company's or Lessor's name, to contest the validity of any tax
or assessment by appropriate proceedings timely instituted and diligently prosecuted. Lessor, if
requested by Company, shall cooperate with Company in any such proceedings; provided, that all
costs and expenses (including attorneys' fees and costs) incurred by Lessor in connection
therewith shall be paid by Company as a Project Cost. Company shall not be responsible for any
of Lessor's franchise, inheritance, income, succession, transfer or other tax levied on the Lessor's
rights in and to the Premises or Lessor's right to receive income from the Premises or under this
Agreement. Company will keep current municipal, state or local licenses or permits required for
the conduct of its business.
IBC Bldg. 1 Ground Lease
13
1112021","2.10
TAXES AND ASSESSMENTS",1
"contractor. Such insurance will provide coverage and limits as are
commercially reasonable in the industry. Such insurance will include,
but is not limited to:
General Liability on an ""occurrence"" basis only
Automobile Liability
Builder's Risk equal to the maximum contract cost of the project.
2.12.2.2
Company's (or its contractor's) insurance will be primary as respects
Lessor and Company, their officers, employees and authorized agents.
Any other coverage carried by or available to Lessor, its officers,
employees and authorized agents will be excess over the insurance
required of the Company or its contractor and shall not contribute with it.
2.12.2.3
Company and its contractors will maintain worker's compensation
insurance in the amounts and form as required by California law.
Certificates evidencing the valid, effective insurance policies will be
provided to LDR.
2.12.2.4
Company will keep insured with responsible insurance underwriters the
Facilities and any improvements from time to time constructed by it
upon and within the Premises to the extent of not less than the full
replacement value of such improvements from time to time (without
deduction for depreciation) using an industry standard all risk form of
protection. Company will use commercially reasonable efforts to cause
its Sublessees or Tenants to keep insured with responsible insurance
underwriters any improvements constructed by such Sublessees or
Tenants to the same extent.
2.12.2.5
Company will obtain and keep in full force and effect a policy(s) of
general liability insurance on an ""occurrence"" basis only and not ""claims
made."" The coverage must be provided either on an ISO Commercial
General Liability form, or an Accord Comprehensive General Liability
form, or equivalent, approved by the LDR and Company. Any
exceptions to coverages must be fully disclosed on the required
Certificate. If other than these forms are submitted as evidence of
compliance, complete copies of such policy forms will be submitted to
LDR within ten (10) days after notice to Company. Policies must
include, but need not be limited to, coverages for bodily injury, property
damage, personal injury, Broad Form property damage, premises and
operations, severability of interest, products and completed operations,
contractual and independent contractors with no exclusions of coverage
for liability resulting from the hazards of explosion, collapse, and
underground property damage.","Before any construction contractor (including Commerce Construction
Co.) Commences Construction of any Facilities or any equipment
installation on or about the Premises, the construction contractor shall
procure and maintain insurance for such construction and installation
protecting both Company and Lessor, as well as the construction
IBC Bldg. 1 Ground Lease
14
1112021",1
"money, Lessor will accept payments of rent from such Leasehold
Mortgagee and this Agreement will not terminate, but will remain in full
force and effect, pending Leasehold Mortgagee's cure of such default
within the time periods described herein or resort to foreclosure or sale
proceedings under its deed of trust or other security instruments.
2.18.4 If any default has been cured by a Leasehold Mortgagee or Assignee, Lessor agrees that
upon completion of any foreclosure proceedings or sale under the deed of trust or other
security instrument securing the loan, or upon delivery of a deed in lieu of foreclosure,
the Leasehold Mortgagee or purchaser at such sale or any heir, successor, or assign of
Leasehold Mortgagee (Assignee) subsequent to such sale will be recognized by Lessor as
the lessee under the terms of this Agreement for all purposes for the remaining term
hereof. The leasehold interest of the Leasehold Mortgagee or such Assignee will not be
adversely affected or terminated by reason of any nonmonetary default occurring prior to
the completion of such proceedings or sale, provided such default has been promptly
remedied (to the extent it is capable of being remedied by Leasehold Mortgagee), or if
such default requires possession to cure, provided such Leasehold Mortgagee, Assignee
or purchaser promptly commences to cure upon taking possession of the Premises.
2.18.5 Such Leasehold Mortgagee will not become personally liable under the terms and
obligations of this Agreement unless and until it assumes the obligations and is
recognized by Lessor as lessee under this Agreement and will be liable only so long as
such Leasehold Mortgagee or Assignee maintains ownership of the leasehold interest or
estate and recourse to such Leasehold Mortgagee or Assignee shall be limited solely to
Leasehold Mortgagee's or Assignee's interest in the Premises.
2.18.6 At any time during the term of this Lease, within ten (10) days after a written request by
the Company or any Leasehold Mortgagee, Lessor, through Lessor's Designated
Representative, will execute, acknowledge and deliver to the Company or such person or
entity as the Company designates, a certificate stating:
(a)
that this Agreement is the only Agreement between Lessor and Company
concerning the Premises and is unmodified and in full force and effect in
accordance with its terms (or if there have been modifications, that this
Agreement is in force and effect as modified, and identifying the modification
agreements, or if this Agreement is not in full force and effect, that it is not);
(b)
the commencement and expiration dates of this Agreement and the date to which
rental has been paid to Lessor under this Agreement;
(c)
whether or not, to the knowledge of the Lessor, there is an existing default by
Company in the payment of Rent or any other sum of money under this
Agreement, and whether or not there is any other existing default by either party
under this Agreement with respect to which a notice of default has been served,
and if there is such a default specifying its nature and extent;
(d)
whether or not, to the knowledge of Lessor, there are any set-offs, defenses or
counter-claims against enforcement of the obligations to be performed by Lessor
or Company under this Agreement; and,
(e)
such other reasonable information relating to this Agreement that a Leasehold
Mortgagee or assignee may request.
2.18.7 All notices of default required to be delivered to a Leasehold Mortgagee under this
Agreement will be sent to any Leasehold Mortgagee by overnight courier service or
certified mail, return receipt requested. No such notice shall be valid or effective as
against the Leasehold Mortgagee until and unless actually received by the Leasehold
Mortgagee as evidenced by the courier service's delivery records or the return receipt.
2.18.8 In the event this Agreement is terminated for any reason prior to the end of the term (it
being the intent that the Agreement will remain in full force and effect if Leasehold
Mortgagee performs), Lessor shall enter into a new Agreement with Leasehold
Mortgagee holding a first priority interest covering the Premises, provided that the
Leasehold Mortgagee (i) requests such new Agreement by written notice to Lessor within
sixty (60) days after termination, and (ii) cures all prior defaults of Company that are
capable of being cured by Leasehold Mortgagee. The new Agreement shall be for the
remainder of the term, effective at the date of such termination, at the same rent and on
the same covenants, agreements, conditions, provisions, restrictions and limitations
IBC Bldg. 1 Ground Lease
21
1112021
contained in this Agreement. The new Agreement shall have the same title priority as
this Agreement and shall be subject only to the exceptions to title having priority over
this Agreement or such additional exceptions to which such Leasehold Mortgagee has
consented in writing. In the event the Lessor and such Leasehold Mortgagee enter into
any such new Agreement, title to all the Facilities located upon the Premises as of the
date of such new Agreement shall automatically vest in such Leasehold Mortgagee. If
requested by such Leasehold Mortgagee, Lessor agrees to execute and deliver to
Leasehold Mortgagee within 10 days after request therefore, a quitclaim deed in
recordable form conveying title to such Facilities to such Leasehold Mortgagee. Lessor
also agrees to assign to such Leasehold Mortgagee all Subleases with Tenants who's
Subleases attorn to Lessor upon the termination of this Agreement.
2.18.9 Lessor shall cooperate in amending this Agreement from time to time to add any
provision which may reasonably be requested by any Leasehold Mortgagee or proposed
lender for the purpose of implementing the mortgagee protection provisions contained in
this Agreement and allowing such Leasehold Mortgagee reasonable means to protect or
preserve the lien of its loan and the value of its security. Lessor agrees to execute and
deliver (and to acknowledge if necessary for recording purposes) any agreement
necessary to effect any such amendment; provided, however, that any such amendment
shall not in any way affect or change the term of this Agreement or the Rent or other
amounts payable to Lessor under this Agreement, subordinate the fee interest of Lessor in
the real property underlying the Premises, nor otherwise in any material respect adversely
affect any rights of Lessor under this Agreement.
2.18.10 The bankruptcy or insolvency of Company will not operate or permit the Lessor to
terminate this Agreement as long as all Rent or other monetary payments required to be
paid by Company continue to be paid and other required obligations are performed in
accordance with the terms of this Agreement.
2.18.11 To the extent any of the terms of this Agreement are inconsistent with the terms of this
Section regarding mortgagee protection provisions, the mortgagee protection provisions
will control.
2.18.12 Every Leasehold Mortgage shall contain a provision that copies of all notices of default
by Company thereunder must be sent to Lessor. In the event of any default by Company
under any Leasehold Mortgage, the Lessor reserves the right to make any payments due
to the Leasehold Mortgagee before the Leasehold Mortgagee resorts to any foreclosure or
sale proceedings under its deed of trust or other security instrument.
2.18.12.1
Following any foreclosure or deed in lieu of foreclosure the leasehold
estate created by this Agreement and the Facilities may be transferred or
assigned as provided in Section 2.1.2.
2.18.13 Any mortgage placed by the Lessor on the fee title to the Premises shall be subordinate to
this Agreement (and any replacement to this Agreement), any separate lease entered into
in accordance with Section 4.8 and all Subleases.
2.18.14 Prior to any termination of this Agreement by Lessor, any Leasehold Mortgagee shall be
allowed sufficient time to complete any foreclosure action, including time for delays due
to official restraint (including by law, process or injunction issued by a court), so long as
such Leasehold Mortgagee is making payments required by this Agreement which can be
reasonably determined prior to acquiring the Company's interest under this Agreement.
Leasehold Mortgagee shall have the right to terminate foreclosure proceedings at any
time if Company has cured all defaults under any loan from Leasehold Mortgagee.
However, no such termination of foreclosure proceedings shall prevent Lessor from
pursuing, or continuing to pursue, its rights and remedies under this Agreement against
Company for any uncured defaults under this Agreement.
2.18.15 So long as any Leasehold Mortgage is in effect, there shall be no merger of the leasehold
estate created by this Agreement into the fee simple estate in the Premises without the
prior written consent of the Leasehold Mortgagee.
2.18.16 Any Leasehold Mortgagee shall have the right to participate in any settlement or
adjustment of losses under insurance policies maintained by Company under this
Agreement. Such Leasehold Mortgagee shall be named as a loss payee or additional
insured, as applicable, in accordance with any loan documents executed by Company,
under the insurance policies required under this Agreement. Company shall use
commercially reasonable efforts to obtain provisions in Leasehold Mortgages providing
IBC Bldg. 1 Ground Lease
22
1112021","2.18
FINANCING
2.18.1 Notwithstanding anything to the contrary contained in this Agreement, Company will
have the right at such time or times as Company desires and without Lessor's consent, to
hypothecate Company's interest in all or part of this Agreement, the Premises and the
Facilities with one or more Leasehold Mortgages. Such Leasehold Mortgages may
contain such terms and conditions as are acceptable to Company and Company will have
the right, without the consent of Lessor, at any time during the term hereof to execute and
deliver to any or all of its Leasehold Mortgagees any documents which will operate as
collateral security for any loan or loans made, even if such document or documents result
in a form or type of conveyance or assignment of the leasehold interest demised
hereunder. It is hereby agreed that Company or any such Leasehold Mortgagees will
have the right to immediately record such document or document(s) with an appropriate
public official or officials. Company agrees that copies of all such documents of
conveyance or assignment as contained in this Section 2.18 will be provided to the LDR
forthwith. Lessor agrees to cooperate in executing any documents reasonably requested
of Lessor by Company or the Leasehold Mortgagee in connection with any such
Leasehold Mortgage; PROVIDED, HOWEVER, UNDER NO CIRCUMSTANCES
SHALL LESSOR BE OBLIGATED TO SUBORDINATE ITS FEE INTEREST IN THE
PREMISES TO ANY LEASEHOLD MORTGAGE, AND, NOTWITHSTANDING
ANY TERM OR PROVISION OF ANY SUCH LEASEHOLD MORTGAGE OR THIS
AGREEMENT TO THE CONTRARY, UNDER NO CIRCUMSTANCES SHALL ANY
SUCH LEASEHOLD MORTGAGE CONSTITUTE AN INDEBTEDNESS OR
OBLIGATION OF LESSOR NOR SHALL LESSOR BE LIABLE IN ANY WAY FOR
THE PAYMENT OF ANY PORTION OF THE INDEBTEDNESS EVIDENCED BY
SUCH LEASEHOLD MORTGAGE OR FOR THE PAYMENT OR PERFORMANCE
OF ANY OTHER OBLIGATION THEREUNDER OR SECURED THEREBY.
2.18.2 Lessor will deliver to any such Leasehold Mortgagee written notice of any default of
Company under the terms of this Agreement and said notice will specify the nature of the
default. Before terminating this Agreement, Lessor will allow such Leasehold Mortgagee
to cure or commence to cure any default of Company in accordance with the provisions
of this Agreement. The time period to cure any default of Company will commence
when said notice is delivered to Leasehold Mortgagee and Leasehold Mortgagee shall
have the same lengths of time to cure the specified default as are permitted Company in
Section 2.14. In the event Company fails to timely cure a default after receipt of written
notice and expiration of any applicable cure period, Lessor agrees to provide any
Leasehold Mortgagee with a second written notice and provide such Leasehold
Mortgagee with an additional thirty (30) day cure period. Lessor will not have the right
to exercise any remedies under this Agreement so long as a Leasehold Mortgagee is
diligently prosecuting to complete a cure of any default. If such default is of a nature
which is incapable of being cured by Leasehold Mortgagee, Lessor agrees not to exercise
its remedies arising from such default if (i) Leasehold Mortgagee notifies Lessor in
writing within such thirty (30) day cure period that Leasehold Mortgagee intends to
foreclose its mortgage and Leasehold Mortgagee commences and diligently pursues such
foreclosure; and (ii) Leasehold Mortgagee makes all payments due by Company under
this Agreement through the date of foreclosure.
2.18.3 Any default by the Company in the payment of money as required under the terms of this
Agreement may be cured by the Leasehold Mortgagee in accordance with the terms of
Sections 2.14 and 2.18.2 of this Agreement, and Lessor will accept any such payment or
cure from such Leasehold Mortgagee during the term of the Leasehold Mortgage.
2.18.3.1
Should the Company default under the terms of this Agreement and
should the default be such that it cannot be cured by the payment of
IBC Bldg. 1 Ground Lease
20
1112021",1
