currentSection,previousSection,isMerge
"Section 1.7.1.1 or Section 1.7.1.2 hereof.
1.1.26 The term ""Rent"" whenever used herein, means fifty percent (50%) of Net Revenue during
each calendar year of the term of this Agreement.","All substances, materials and wastes that are, or that become, regulated under, or
that are classified as hazardous or toxic under any environmental law, whether
such laws are Federal, State or local.
1.1.14 The term ""Leasehold Mortgagee"", wherever used herein, means any lender of
Company holding the beneficial interest in any Leasehold Mortgage and which Leasehold
Mortgagee is a bank, savings and loan, insurance company, pension trust, real estate
investment trust, mortgage company, or other institutional lender unaffiliated with the
Company.
1.1.15 The term ""Leasehold Mortgage"", wherever used herein means any mortgage or deed of
trust which is in favor of a Leasehold Mortgagee encumbering the Company's interest in
this Agreement, the leasehold estate created hereunder and/or the Facilities from time to
time located on the Premises and which has been incurred for, and the proceeds of which
are used for, the purpose of financing the construction of the Facilities and the payment
of other Project Costs or refinancing an existing Leasehold Mortgage. The proceeds of
any refinancing, to the extent not used to pay off the Leasehold Mortgage being
refinanced, shall be used for the purpose of: (i) repairing, constructing or reconstructing
the Facilities; (ii) held in reserve for such purposes; (iii) the payment of other Project
Costs; (iv) used for the repayment of Equity Contributions and interest thereon or (v)
used for such other purposes as Lessor and Company may, in writing, agree. No
Leasehold Mortgage shall encumber any interest in any real property other than
Company's leasehold interest under this Agreement and the Facilities.
1.1.16 The term ""Management Fee,"" whenever used herein, means the payment, as a Project
Cost, to Company or any property manager it selects for the administration and
management of the Premises and the Facilities. Such fee shall be three percent (3%) of
Total Revenue received by Company from Tenants and Sublessees each month during the
term of this Agreement. The Management Fee shall be paid to Company or its property
manager on a monthly or other basis selected by Company, as funds are available from
Total Revenue to pay the Management Fee, before any payments of Rent or repayment of
Equity Contributions.
1.1.17 The term ""Maintenance and Operations expense,"" whenever used herein, means the
expense for maintenance, operation, administration and repair of the Premises and the
Facilities, including, but not limited to, repair, maintenance or replacement of the
plumbing, heating, ventilating and air conditioning systems, electrical systems, lighting
facilities, fire protection systems, utility installations, fixtures, walls, foundations, roof,
ceilings, floors, structural systems, doors, glass, skylights, landscaping and irrigating
systems, driveways, parking lots, fences, retaining walls, signs, sidewalks, and the cost of
all janitorial service, trash disposal, water, gas, electricity, and other utilities, together
with any taxes thereon.
1.1.18 The term ""Net Revenue,"" whenever used herein, means the amount of cash available
after deducting from Total Revenue in the following order of priority: (a) Debt Service;
(b) all Project Costs incurred during such calendar year of the term of this Agreement; (c)
reasonable reserves for future Maintenance and Operations expense, future Capital
Improvement expense or any reserve required by any Leasehold Mortgagee and (d) the
repayment of Equity Contributions and interest thereon.
IBC Bldg. 1 Ground Lease
3
1112021
1.1.19 The term ""Participating Parties"" or ""Parties,"" whenever used herein, means Company as
lessee and the Successor Agency to the Industry Urban-Development Agency as Lessor
(hereinafter jointly referred to as ""Parties""), their successors and assigns.
1.1.20 The term ""Premises,"" whenever used herein, means that area described on Exhibit ""A"".
Final legal descriptions of the Premises will be attached to the Memorandum of Lease
described in Section 1.2.3.
1.1.21 Except as otherwise provided in this Agreement, the term ""Project Cost,"" whenever used
herein, means all necessary costs incurred by Company (excluding Rent) prior to or after
the date hereof in connection with the subdividing, designing, constructing, owning,
leasing, financing or managing the Premises or the Facilities and other improvements
constructed on the Premises by Company, or its successors and assigns. Except as
otherwise provided in this Agreement, Project Cost shall include (without duplication),
but not be limited to, the following: (a) all architectural and engineering expense, (b) all
plan check fees, building permit fees, school fees, drainage fees and all other
governmental, railroad and utility fees, licenses and permit cost, (c) all costs of
environmental impact reports, traffic studies, biological studies and all other reports and
studies required by governmental agencies, railroads or utility companies, (d) all costs to
subdivide and re-subdivide the Premises, (e) all costs incurred by Company in
constructing the Facilities or other permitted improvements on the Premises, (f) all
Capital Improvement Expense, (g) all Maintenance and Operations expense, (h) all
Management Fees, (i) except as provided in Section 2.12.2.10, all costs incurred for
uninsured losses, earthquake, flood or other casualty, or repairs or replacements to the
Premises and the Facilities or other improvements and the unreimbursed portion of any
insured losses, (j) except as provided in Article III, all costs of complying with
Environmental Laws, (k) all insurance premiums for insurance required hereunder and
property taxes, (l) all leasing commissions and all other marketing and advertising
expense, (m) all legal and accounting fees, (n) all loan fees, points, appraisal fees and
other costs associated with the obtaining of Leasehold Mortgages, (o) all interest on
Leasehold Mortgages, (p) all costs incurred by Company to create a community facilities
district or districts or other assessment or other public financing district or districts to
finance the construction of street improvements, utilities or other public improvements
upon the Premises and (q) all other expenses related to the use, maintenance, leasing,
financing and operation of the Premises and the Facilities. Project Costs shall only
include costs, expenses and other amounts to the extent the same are reasonable and
competitive in amount. Without limiting the preceding sentence, any costs, expenses or
other amounts specified in an Approved Budget or otherwise approved in writing by
LDR shall be deemed a reasonable and competitive amount. Further, Project Cost shall
not include any cost, expense or other amount which is included within any other cost,
expense or amount which is permitted by this Agreement to be deducted from Total
Revenue in calculating Net Revenue, the intention of the Parties being that no cost,
expense or other amount which is so permitted to be deducted from Total Revenue be
deducted therefrom more than once.
1.1.22 The term ""Sublease,"" whenever used herein, means the documents signed by a Sublessee
or Tenant of Company for the leasing of a portion of the Premises or space in the
Facilities.
1.1.23 The term ""Sublessee"" or ""Tenant,"" whenever used herein, means any individual,
corporation, limited liability company, trust, business, firm or other entity that leases or
otherwise occupies or uses all or any portion of the Premises or the Facilities under a
lease, rental agreement or other arrangement with Company.
1.1.24 The term ""Release,"" whenever used herein, means any releasing, spilling, leaking,
pumping, pouring, emitting, emptying, discharging, injecting, escaping, leaching,
disposing or dumping of any Hazardous Material in violation of Environmental Laws.
1.1.25 The term ""Total Revenue,"" whenever used herein, means the total amount of all rents,
charges, fees and/or other income derived or received, directly or indirectly, by Company
from the use, operation and/or leasing of all or part of the Premises or the Facilities,
including, without limitation, all rents, charges, fees and/or other income and amounts
received from Sublessees or Tenants of all or any part of the Premises or the Facilities
during each full or partial calendar year of the term of this Agreement and the net
proceeds received by Company as a result of a Total Taking, Partial Taking or
Temporary Taking from an eminent domain proceeding referred to in Section 2.19.
Insurance proceeds are excluded from Total Revenue as they are covered by other
provisions of this Agreement.
IBC Bldg. 1 Ground Lease
4
1112021
1.1.26 The term ""Equity Contribution"" whenever used herein, means any funds provided by
Company, Lessor or any Leasehold Mortgagee in accordance with the provisions of",1
"1.3
PREMISES
1.3.1
Lessor does hereby demise and let unto Company and Company does hereby take from
Lessor that certain real property (hereinafter referred to as ""Premises"") as follows:
The land described on Exhibit ""A"" which is attached hereto and made a part
hereof, together with all improvements located thereon (which improvements are
owned by Company) together with all appurtenances, rights, privileges and
easements appertaining thereto.
IBC Bldg. 1 Ground Lease
5
1112021
1.3.2 Lessor shall cause the work described on Exhibit ""B"" to be performed in
accordance with the provisions of Exhibit ""B"" which is attached hereto and made a part
hereof. Lessor shall commence such work within thirty (30) days after the date of this
Agreement and shall complete such work as soon as reasonably possible, subject to
extensions due to force majeure events as provided in Section 4.1. Lessor shall use
commercially reasonable efforts to coordinate the timing of such work with Company's
development of the Premises. All such work shall be at Lessor's sole cost and expense
and shall not be considered an Equity Contribution by Lessor.","1.2
TERM AND CONDITIONS PRECEDENT
1.2.1
The term of this Agreement shall commence on December 1, 2021.
1.2.2
The term of this Agreement will expire on October 9, 2087.
1.2.3
Lessor and Company agree to execute a memorandum of this Agreement evidencing the
existence of this Agreement, the ownership of the Facilities by Company, the rights of
Company in the Premises, the fact that this Agreement contains a right of first refusal to
purchase the Premises and setting forth the Commencement Date and Termination Date
of this Agreement.
1.2.4 Company will be entitled to receive, as a Project Cost, an ALTA leasehold policy of title
insurance issued by a title company selected by Company, with liability in an amount
reasonably determined by Company and insuring Company's interests hereunder. Such
leasehold policy will be subject only to exceptions permitted by Company. By
September 1, 2019, Lessor shall deliver a preliminary title reports covering the Premises,
as well as copies of the underlying document listed as exceptions to title is such report, to
Company. If Company objects to any exceptions, it will give written notice of such
objections (the ""Notice of Objections"") to Lessor within such one hundred twenty (120)
days after receipt of the preliminary report and the underlying documents. Company's
failure to give a Notice of Objections within such One Hundred Twenty (120) day period
shall be conclusively deemed to be Company's acceptance of all exceptions. Within
thirty (30) days following receipt of a Notice of Objections, Lessor, at its option, may
cure, or agree to cure prior to the commencement of the term, some or all of the
exceptions that are the subject of the Notice of Objections. If at the end of such thirty
(30) day period, Lessor has not cured, or agreed to cure prior to the commencement of the
term, any or all of such exceptions, Company may elect by written notice given within
fifteen (15) days thereafter to terminate this Lease (the ""Termination Notice"").
Company's failure to give the Termination Notice within such fifteen (15) day period
shall be conclusively deemed to be Company's election to accept such leasehold policy
subject to all then uncured exceptions. Upon any termination of this Agreement pursuant
to the provisions of this Section, the parties shall be released from all further liabilities
and obligations under this Agreement, except for such as have accrued prior to the date of
such termination. Notwithstanding the foregoing, Lessor agrees to remove, prior to the
commencement of the term of this Lease, all loans secured by deeds of trust or mortgages
encumbering the Premises as well as any leases or rental agreements encumbering all or
any portion of the Premises. Lessor agrees not to create or permit the creation of any
additional exceptions to title, after the date of the preliminary title report, without the
written consent of Company.
As Facilities are constructed on the Premises, Company shall be entitled to obtain, as a
Project Cost, additional ALTA leasehold title insurance with liability in an amount
reasonably determined by Company and insuring Company's interests and the interest of
any Leasehold Mortgagee hereunder.
1.2.5 Any amendments to this Agreement will not be effective as against any Leasehold
Mortgagee unless Company has obtained the written consent of such Leasehold
Mortgagee.",0
"Tenants' providing for the payment of at least six (6) months' rent, taxes,
insurance and maintenance expenses payable by Sublessees or Tenants
under its Sublease.
1.5.3
If requested by Lessor, the Company will provide Lessor with a copy of any rules,
regulations or other standards of operation developed by Company and distributed to
Sublessees and Tenants.
1.5.4
In the event that the sublease of a portion of the Premises constitutes a change of
ownership for property tax purposes, it is the desire of the Parties that such change in
ownership and reappraisal of the subleased property be limited to the particular portion of
the Premises which are the subject of such sublease and not be deemed a change of
ownership for assessment purposes for any remaining portion of the Premises.","1.5
DEVELOPMENT AND SUBLEASING
1.5.1
Company will develop the Premises and construct the Facilities substantially in
accordance with plans and specifications prepared by Company in accordance with
applicable governmental statutes, ordinances, rules and regulations, including those of the
City of Industry and the Successor Agency to the Industry Urban-Development Agency.
1.5.2
Company may enter into subleases with Sublessees or Tenants on terms and conditions
that are satisfactory to Company, provided such subleases are on sublease forms that have
been approved by the LDR. LDR must approve or disapprove any sublease forms within
15 days of submittal by Company. Failure of the LDR to give written notice of
disapproval, stating the specific objections to any such form, within the time specified
shall be deemed approval.
1.5.2.1
Company may negotiate changes to such approved forms which are
typically given to Sublessees or Tenants in similar transactions without
the consent of Lessor. In the event there are substantive changes or
exceptions to the standard forms of sublease arrangements which are not
typically given to Sublessees or Tenants in similar transactions, the
Company must obtain the written approval of LDR, which approval will
not be unreasonably withheld. LDR must approve or disapprove any
such requested change within 2 business days of submittal by Company.
Failure of the LDR to give written notice of disapproval, stating the
specific reason for disapproving the requested change within the time
specified shall be deemed approval.
1.5.2.2
All Subleases must be for purposes as permitted in Section 1.4, entitled
USE OF PREMISES, of this Agreement and shall expressly provide that
they are subject and subordinate to all provisions of this Agreement.
1.5.2.3
Except pursuant to Subleases as provided in this Section 1.5, Company
shall not suffer or permit the use or occupancy of all or any portion of the
Premises by any person or entity.
1.5.2.4
Rental interruption insurance or rental abatement insurance (as the case
may be) shall be maintained (if available) by Company or Sublessee's or
IBC Bldg. 1 Ground Lease
6
1112021",1
"rate shall be effective on the effective date of each and every change in the
""prime"" rate as, from time to time, announced by Bank of America, N.A. as its
""prime"" rate of interest. Should Bank of America, N.A. no longer exist or fail to
announce a ""prime"" rate, the ""prime"" rate, for purposes of this Lease, shall be the
""prime"" rate published in The Wall Street Journal, or if The Wall street Journal
fails to publish a ""prime"" rate, the rate that most closely approximates the
""prime"" rate published in The Wall Street Journal or other similar financial
publication.
1.7.1.5 The Participating Parties will acknowledge the date any equity contribution is
paid in full by written notice from the Company and acknowledgment by the
LDR.
1.7.2
Rent.
1.7.2.1 Fifty percent (50%) of all Net Revenue, if any, during each calendar year or
partial calendar year during the term of this Agreement shall be paid to Lessor as
Rent for the Premises.
1.7.3
Rent shall be paid to Lessor in monthly installments on or before the twenty-fifth (25th)
day following the end of each calendar month. Such payments shall be accompanied by a
written statement setting forth in detail the sources and amount of Total Revenue
received for the preceding month and allowable deductions for the Net Revenue
calculation. A check for the Lessor's fifty percent (50%) share of Net Revenue will be
submitted with such statement. Except as otherwise provided in this Agreement, all Rent
shall be paid without deduction, offset or abatement.
1.7.4
Company will make all payments to the Lessor at 15625 Mayor Dave Way, City of Industry,
California 91744 or to such other place as Lessor may direct Company in writing.
1.7.5
In addition to, and without limiting, any other right or remedy which Lessor may have
under this Agreement or at law or in equity, in the event any required payment is not
made by Company to Lessor as required and remains unpaid for a period of thirty (30)
days or more, the Lessor will be entitled to, and Company will pay to the Lessor, interest
at the lower of ten percent (10%) per annum or the maximum amount allowed by law on
all amounts unpaid and which remain unpaid thirty (30) days past the due date.
1.7.6
On or prior to April 30, annually during the term of this Agreement and within one
hundred twenty (120) days after the expiration of the term of this Agreement, Company
will provide Lessor with a statement showing in detail the sources and amount of Total
Revenue received for the entire preceding calendar year. Such statement shall be
prepared by the Company's chief financial officer in accordance with sound accounting
principles and practices and shall contain a written opinion of such officer as to whether
the Total Revenue calculations and distribution of Net Revenue and Rent has been made
in accordance with the provisions of this Agreement. Should such statements show that
the amount of Rent paid during the period of review was less than that which was due,
such statement shall be accompanied by Company's payment of the additional amount to
Lessor. Should such statement show that Company paid Lessor more than was due, after
review and verification by LDR, a credit will be issued to be applied against future
monthly installments of Rent, except that if such should be the case at the end of the last
month of this Agreement, Lessor will refund the overpayment to Company.",".
1.7.1.2 Any additional capital required for the operation or maintenance of the Premises
and the Facilities or other Project Costs following completion of construction of
the Facilities on any separate legal parcel of the Premises and any capital
required to repay any Leasehold Mortgages thereon, shall be contributed fifty
percent (50%) by Company and fifty percent (50%) by Lessor within thirty (30)
days of the receipt of demand by Company for such capital, which demand shall
be accompanied by information and evidence, in reasonable detail, substantiating
the amount and reasons for such demand. If any party fails to make such Equity
Contribution, the other party may make such Equity Contribution for the
delinquent party.
1.7.1.3 In the event of default by Company and the subsequent foreclosure and sale of
the leasehold interest to another party, or in the event of a deed in lieu of
foreclosure, the total unpaid balance of the Leasehold Mortgage at the date of the
foreclosure sale or recording of the deed in lieu of foreclosure, including all costs
of foreclosure, shall be considered an Equity Contribution of the Leasehold
Mortgagee or purchaser at foreclosure, as the case may be, as of the date of such
foreclosure sale or the date of recording the deed in lieu of foreclosure.
1.7.1.4 Any portion of Total Revenue remaining after payment by Company of Debt
Service and all costs (except Rent) associated with the ownership, operation,
financing, maintenance and leasing of the Premises and the Facilities, during
each calendar year of the term of this Agreement will be applied to the Parties
Equity Contributions until such time as all Equity Contributions are repaid in full
together with interest thereon. All Equity Contributions made in accordance with
the provisions of Section 1.7.1.1 and all Equity Contributions made in
accordance with Section 1.7.1.3 shall be repaid in full prior to the repayment of
any Equity Contributions made in accordance with Section 1.7.1.2. All Equity
Contributions shall bear interest from the date of contribution until repaid at the
lower of the annual rate of interest publicly announced from time to time by
Bank of America, N.A. as its ""prime"" rate of interest plus three (3%) percent or
the maximum rate allowed by law. The interest rate payable hereunder shall
fluctuate with any change in the ""prime"" rate, and such fluctuations in the interest
IBC Bldg. 1 Ground Lease
8
1112021",1
"If such audit discloses that the calculation of Net Revenue previously provided to Lessor
by Company is understated (either intentionally or unintentionally) by a greater margin
than one percent (1%) of Company's Total Revenue for the period of review, then
Company will immediately pay to Lessor the cost of such audit; otherwise the cost of the
audit will be paid by Lessor. In all events, Company shall pay to Lessor the additional
payments shown to be payable to Lessor by Company.","1.8.
RECORDS AND AUDIT
1.8.1
Throughout the term of this Agreement, Company shall keep and maintain, in accordance
with sound accounting principles and practices, accurate and complete books, records and
accounts of Total Revenue and all items constituting deductions for purposes of
calculating Net Revenue. Within ten days of request by Lessor, Company agrees to
provide for inspection and copying by the Lessor or its designated representatives, at a
location in the metropolitan area of Los Angeles County, California, such books, records,
and accounts for the then current and three (3) immediately preceding calendar years.
Such inspection shall take place Monday through Friday, 9:00 AM to 5:00 PM, holidays
excluded.
1.8.2
Lessor will, at any time, have the right to cause an audit of the Company's operation of
the Premises and of Total Revenue and all items constituting deductions for purposes of
calculating Net Revenue, for the then current or three (3) immediately preceding calendar
years. Such audit shall be made by a Certified Public Accountant of Lessor's selection.
IBC Bldg. 1 Ground Lease
9
1112021",1
